id,type,start_pos,end_pos,surface,beginDate,end_date,value
gallo_young:672,,1047,1108,"in the time of the Florentine architect, Antonio da San Gallo",,,
gallo_young:673,,99,115,in the year 1512,,,
gallo_young:673,,283,305,the death of Julius II,,,
gallo_young:674,,0,27,In the time of Pope Paul II,,,
gallo_young:674,,213,231,at the present day,,,
gallo_young:674,,414,454,"in the time of Clement, in the year 1526",,,
gallo_young:676,,36,106,at the time when his nephew Alessandro de' Medici was Duke of Florence,,,
