id,sentence
agnolo:608,"To one Michele d'Agnolo of Poggibonzi, in the village of Montorsoli, which is three miles distant from Florence on the road to Bologna, where he had a good farm of some size, there was born a male child, to whom he gave the name of his father, Agnolo. That child, growing up, and having an inclination for design, as could be readily seen, was placed by his father, according to the advice of friends, to learn stone-cutting under some masters who worked at the quarries of Fiesole, almost opposite to Montorsoli. Agnolo continuing to ply the chisel with those masters, in company with Francesco del Tadda, who was then a lad, and with others, not many months had passed before he knew very well how to handle the tools and to execute many kinds of work in that profession. Having then contracted a friendship by means of Francesco del Tadda with Maestro Andrea, a sculptor of Fiesole, the genius of the child so pleased that master, that he conceived an affection for him, and began to teach him; and thus he kept him in his workshop for three years. After which time, his father Michele being dead, Agnolo went off in company with other young stone-cutters to Rome, where, having been set to work on the building of S. Pietro, he carved some of those rosettes that are in the great cornices which encircle the interior of that temple, with much profit to himself and a good salary. Having then departed from Rome, I know not why, he placed himself in Perugia with a master stone-cutter, who at the end of a year left him in charge of all his works. But, recognizing that to stay at Perugia was not the life for him, and that he was not learning, he went off, when the opportunity to depart presented itself, to work on the tomb of M. Raffaello Maffei, called Il  Volterrano, at Volterra; and in that work, which was being made in marble, he carved some things which showed that his genius was destined some day to achieve a good result."
agnolo:609,"These buildings being then suspended in the year 1527 on account of the plague and for other reasons, Agnolo, not knowing what else to do, went to Poggibonzi, from which place his father and grandfather had their origin; and there he remained for a time with M. Giovanni Norchiati, his uncle, a pious and well-lettered man, doing nothing but draw and study."
agnolo:610,"That Fra Martino, having recognized the young man's genius, reflected that he was little able to exercise it among those Fathers, who do nothing but say Paternosters, make windows of glass, distil waters, and lay out gardens, with other suchlike pursuits, and do not study or give their attention to letters; and he contrived to say and do so much that the young man, going forth from the Ingesuati, assumed the habit among the Servite Friars of the Nunziata in Florence on the seventh day of October in the year 1530, receiving the name of Fra Giovanni Agnolo."
agnolo:611,"When Michelagnolo, with the assistance of Fra Giovanni Agnolo, had finished and placed in position the statues of Duke Giuliano and Duke Lorenzo, being summoned by the Pope, who wished that arrangements should be made for executing in marble the façade of S. Lorenzo, he went to Rome; but he had not made a long stay there, when, Pope Clement dying, everything was left unfinished."
agnolo:613,"These were executed under the direction of the Frate, who, having at the last constructed a fish-pond in front of that Palace, made a sea monster of marble in full-relief, which pours water in great abundance into that fish-pond; and after the likeness of that monster he made for those lords another, which was sent into Spain to Granvela."
agnolo:614,"Finally Fra Giovanni Agnolo departed from Genoa and went to Naples, where he set up in the place already mentioned the tomb of Sannazzaro, which is composed in this fashion."
